id,b,c,v,t
11005001,11,5,1,Hiram king of Tyre sent his servants to Solomon; for he had heard that they had anointed him king in the room of his father: for Hiram was ever a lover of David.
11005002,11,5,2,"Solomon sent to Hiram, saying,"
11005003,11,5,3,"You know how that David my father could not build a house for the name of Yahweh his God for the wars which were about him on every side, until Yahweh put them under the soles of his feet."
11005004,11,5,4,"But now Yahweh my God has given me rest on every side; there is neither adversary, nor evil occurrence."
11005005,11,5,5,"Behold, I purpose to build a house for the name of Yahweh my God, as Yahweh spoke to David my father, saying, Your son, whom I will set on your throne in your room, he shall build the house for my name."
11005006,11,5,6,Now therefore command you that they cut me cedar trees out of Lebanon; and my servants shall be with your servants; and I will give you hire for your servants according to all that you shall say: for you know that there is not among us any who knows how to cut timber like the Sidonians.
11005007,11,5,7,"It happened, when Hiram heard the words of Solomon, that he rejoiced greatly, and said, Blessed be Yahweh this day, who has given to David a wise son over this great people."
11005008,11,5,8,"Hiram sent to Solomon, saying, I have heard [the message] which you have sent to me: I will do all your desire concerning timber of cedar, and concerning timber of fir."
11005009,11,5,9,"My servants shall bring them down from Lebanon to the sea; and I will make them into rafts to go by sea to the place that you shall appoint me, and will cause them to be broken up there, and you shall receive them; and you shall accomplish my desire, in giving food for my household."
11005010,11,5,10,So Hiram gave Solomon timber of cedar and timber of fir according to all his desire.
11005011,11,5,11,"Solomon gave Hiram twenty thousand measures of wheat for food to his household, and twenty measures of pure oil: thus gave Solomon to Hiram year by year."
11005012,11,5,12,"Yahweh gave Solomon wisdom, as he promised him; and there was peace between Hiram and Solomon; and they two made a league together."
11005013,11,5,13,King Solomon raised a levy out of all Israel; and the levy was thirty thousand men.
11005014,11,5,14,"He sent them to Lebanon, ten thousand a month by courses; a month they were in Lebanon, and two months at home; and Adoniram was over the men subject to forced labor."
11005015,11,5,15,"Solomon had seventy thousand who bore burdens, and eighty thousand who were stone cutters in the mountains;"
11005016,11,5,16,"besides Solomon's chief officers who were over the work, three thousand and three hundred, who bore rule over the people who labored in the work."
11005017,11,5,17,"The king commanded, and they hewed out great stones, costly stones, to lay the foundation of the house with worked stone."
11005018,11,5,18,"Solomon's builders and Hiram's builders and the Gebalites did fashion them, and prepared the timber and the stones to build the house."
11006001,11,6,1,"It happened in the four hundred and eightieth year after the children of Israel were come out of the land of Egypt, in the fourth year of Solomon's reign over Israel, in the month Ziv, which is the second month, that he began to build the house of Yahweh."
11006002,11,6,2,"The house which king Solomon built for Yahweh, the length of it was sixty cubits, and the breadth of it twenty [cubits], and the height of it thirty cubits."
11006003,11,6,3,"The porch before the temple of the house, twenty cubits was the length of it, according to the breadth of the house; [and] ten cubits was the breadth of it before the house."
11006004,11,6,4,For the house he made windows of fixed lattice-work.
11006005,11,6,5,"Against the wall of the house he built stories round about, against the walls of the house round about, both of the temple and of the oracle; and he made side-chambers round about."
11006006,11,6,6,"The nethermost story was five cubits broad, and the middle was six cubits broad, and the third was seven cubits broad; for on the outside he made offsets [in the wall] of the house round about, that [the beams] should not have hold in the walls of the house."
11006007,11,6,7,"The house, when it was in building, was built of stone made ready at the quarry; and there was neither hammer nor axe nor any tool of iron heard in the house, while it was in building."
11006008,11,6,8,"The door for the middle side-chambers was in the right side of the house: and they went up by winding stairs into the middle [story], and out of the middle into the third."
11006009,11,6,9,"So he built the house, and finished it; and he covered the house with beams and planks of cedar."
11006010,11,6,10,"He built the stories against all the house, each five cubits high: and they rested on the house with timber of cedar."
11006011,11,6,11,"The word of Yahweh came to Solomon, saying,"
11006012,11,6,12,"Concerning this house which you are building, if you will walk in my statutes, and execute my ordinances, and keep all my commandments to walk in them; then will I establish my word with you, which I spoke to David your father."
11006013,11,6,13,"I will dwell among the children of Israel, and will not forsake my people Israel."
11006014,11,6,14,"So Solomon built the house, and finished it."
11006015,11,6,15,"He built the walls of the house within with boards of cedar: from the floor of the house to the walls of the ceiling, he covered them on the inside with wood; and he covered the floor of the house with boards of fir."
11006016,11,6,16,"He built twenty cubits on the hinder part of the house with boards of cedar from the floor to the walls [of the ceiling]: he built [them] for it within, for an oracle, even for the most holy place."
11006017,11,6,17,"The house, that is, the temple before [the oracle], was forty cubits [long]."
11006018,11,6,18,"There was cedar on the house within, carved with buds and open flowers: all was cedar; there was no stone seen."
11006019,11,6,19,"He prepared an oracle in the midst of the house within, to set there the ark of the covenant of Yahweh."
11006020,11,6,20,"Within the oracle was [a space of] twenty cubits in length, and twenty cubits in breadth, and twenty cubits in the height of it; and he overlaid it with pure gold: and he covered the altar with cedar."
11006021,11,6,21,So Solomon overlaid the house within with pure gold: and he drew chains of gold across before the oracle; and he overlaid it with gold.
11006022,11,6,22,"The whole house he overlaid with gold, until all the house was finished: also the whole altar that belonged to the oracle he overlaid with gold."
11006023,11,6,23,"In the oracle he made two cherubim of olive-wood, each ten cubits high."
11006024,11,6,24,"Five cubits was the one wing of the cherub, and five cubits the other wing of the cherub: from the uttermost part of the one wing to the uttermost part of the other were ten cubits."
11006025,11,6,25,The other cherub was ten cubits: both the cherubim were of one measure and one form.
11006026,11,6,26,"The height of the one cherub was ten cubits, and so was it of the other cherub."
11006027,11,6,27,"He set the cherubim within the inner house; and the wings of the cherubim were stretched forth, so that the wing of the one touched the one wall, and the wing of the other cherub touched the other wall; and their wings touched one another in the midst of the house."
11006028,11,6,28,He overlaid the cherubim with gold.
11006029,11,6,29,"He carved all the walls of the house round about with carved figures of cherubim and palm trees and open flowers, inside and outside."
11006030,11,6,30,"The floor of the house he overlaid with gold, inside and outside."
11006031,11,6,31,For the entrance of the oracle he made doors of olive-wood: the lintel [and] door-posts were a fifth part [of the wall].
11006032,11,6,32,"So [he made] two doors of olive-wood; and he carved on them carvings of cherubim and palm trees and open flowers, and overlaid them with gold; and he spread the gold on the cherubim, and on the palm trees."
11006033,11,6,33,"So also made he for the entrance of the temple door-posts of olive-wood, out of a fourth part [of the wall];"
11006034,11,6,34,"and two doors of fir-wood: the two leaves of the one door were folding, and the two leaves of the other door were folding."
11006035,11,6,35,He carved [thereon] cherubim and palm trees and open flowers; and he overlaid them with gold fitted on the engraved work.
11006036,11,6,36,"He built the inner court with three courses of hewn stone, and a course of cedar beams."
11006037,11,6,37,"In the fourth year was the foundation of the house of Yahweh laid, in the month Ziv."
11006038,11,6,38,"In the eleventh year, in the month Bul, which is the eighth month, was the house finished throughout all the parts of it, and according to all the fashion of it. So was he seven years in building it."
11007001,11,7,1,"Solomon was building his own house thirteen years, and he finished all his house."
11007002,11,7,2,"For he built the house of the forest of Lebanon; the length of it was one hundred cubits, and the breadth of it fifty cubits, and the height of it thirty cubits, on four rows of cedar pillars, with cedar beams on the pillars."
11007003,11,7,3,"It was covered with cedar above over the forty-five beams, that were on the pillars; fifteen in a row."
11007004,11,7,4,"There were beams in three rows, and window was over against window in three ranks."
11007005,11,7,5,All the doors and posts were made square with beams: and window was over against window in three ranks.
11007006,11,7,6,"He made the porch of pillars; the length of it was fifty cubits, and the breadth of it thirty cubits; and a porch before them; and pillars and a threshold before them."
11007007,11,7,7,"He made the porch of the throne where he was to judge, even the porch of judgment: and it was covered with cedar from floor to floor."
11007008,11,7,8,"His house where he was to dwell, the other court within the porch, was of the like work. He made also a house for Pharaoh's daughter (whom Solomon had taken as wife), like this porch."
11007009,11,7,9,"All these were of costly stones, even of hewn stone, according to measure, sawed with saws, inside and outside, even from the foundation to the coping, and so on the outside to the great court."
11007010,11,7,10,"The foundation was of costly stones, even great stones, stones of ten cubits, and stones of eight cubits."
11007011,11,7,11,"Above were costly stones, even hewn stone, according to measure, and cedar-wood."
11007012,11,7,12,"The great court round about had three courses of hewn stone, and a course of cedar beams; like as the inner court of the house of Yahweh, and the porch of the house."
11007013,11,7,13,King Solomon sent and fetched Hiram out of Tyre.
11007014,11,7,14,"He was the son of a widow of the tribe of Naphtali, and his father was a man of Tyre, a worker in brass; and he was filled with wisdom and understanding and skill, to work all works in brass. He came to king Solomon, and performed all his work."
11007015,11,7,15,"For he fashioned the two pillars of brass, eighteen cubits high apiece: and a line of twelve cubits compassed either of them about."
11007016,11,7,16,"He made two capitals of molten brass, to set on the tops of the pillars: the height of the one capital was five cubits, and the height of the other capital was five cubits."
11007017,11,7,17,"There were nets of checker-work, and wreaths of chain-work, for the capitals which were on the top of the pillars; seven for the one capital, and seven for the other capital."
11007018,11,7,18,"So he made the pillars; and there were two rows round about on the one network, to cover the capitals that were on the top of the pillars: and so did he for the other capital."
11007019,11,7,19,"The capitals that were on the top of the pillars in the porch were of lily-work, four cubits."
11007020,11,7,20,"There were capitals above also on the two pillars, close by the belly which was beside the network: and the pomegranates were two hundred, in rows round about on the other capital."
11007021,11,7,21,"He set up the pillars at the porch of the temple: and he set up the right pillar, and called the name of it Jachin; and he set up the left pillar, and called the name of it Boaz."
11007022,11,7,22,On the top of the pillars was lily-work: so was the work of the pillars finished.
11007023,11,7,23,"He made the molten sea of ten cubits from brim to brim, round in compass, and the height of it was five cubits; and a line of thirty cubits compassed it round about."
11007024,11,7,24,"Under the brim of it round about there were buds which did compass it, for ten cubits, compassing the sea round about: the buds were in two rows, cast when it was cast."
11007025,11,7,25,"It stood on twelve oxen, three looking toward the north, and three looking toward the west, and three looking toward the south, and three looking toward the east; and the sea was set on them above, and all their hinder parts were inward."
11007026,11,7,26,"It was a handbreadth thick: and the brim of it was worked like the brim of a cup, like the flower of a lily: it held two thousand baths."
11007027,11,7,27,"He made the ten bases of brass; four cubits was the length of one base, and four cubits the breadth of it, and three cubits the height of it."
11007028,11,7,28,The work of the bases was on this manner: they had panels; and there were panels between the ledges;
11007029,11,7,29,"and on the panels that were between the ledges were lions, oxen, and cherubim; and on the ledges there was a pedestal above; and beneath the lions and oxen were wreaths of hanging work."
11007030,11,7,30,"Every base had four brazen wheels, and axles of brass; and the four feet of it had supports: beneath the basin were the supports molten, with wreaths at the side of each."
11007031,11,7,31,"The mouth of it within the capital and above was a cubit: and the mouth of it was round after the work of a pedestal, a cubit and a half; and also on the mouth of it were engravings, and their panels were foursquare, not round."
11007032,11,7,32,The four wheels were underneath the panels; and the axles of the wheels were in the base: and the height of a wheel was a cubit and half a cubit.
11007033,11,7,33,"The work of the wheels was like the work of a chariot wheel: their axles, and their rims, and their spokes, and their naves, were all molten."
11007034,11,7,34,There were four supports at the four corners of each base: the supports of it were of the base itself.
11007035,11,7,35,In the top of the base was there a round compass half a cubit high; and on the top of the base the stays of it and the panels of it were of the same.
11007036,11,7,36,"On the plates of the stays of it, and on the panels of it, he engraved cherubim, lions, and palm trees, according to the space of each, with wreaths round about."
11007037,11,7,37,"After this manner he made the ten bases: all of them had one casting, one measure, and one form."
11007038,11,7,38,He made ten basins of brass: one basin contained forty baths; and every basin was four cubits; and on very one of the ten bases one basin.
11007039,11,7,39,"He set the bases, five on the right side of the house, and five on the left side of the house: and he set the sea on the right side of the house eastward, toward the south."
11007040,11,7,40,"Hiram made the basins, and the shovels, and the basins. So Hiram made an end of doing all the work that he worked for king Solomon in the house of Yahweh:"
11007041,11,7,41,"the two pillars, and the two bowls of the capitals that were on the top of the pillars; and the two networks to cover the two bowls of the capitals that were on the top of the pillars;"
11007042,11,7,42,"and the four hundred pomegranates for the two networks; two rows of pomegranates for each network, to cover the two bowls of the capitals that were on the pillars;"
11007043,11,7,43,"and the ten bases, and the ten basins on the bases;"
11007044,11,7,44,"and the one sea, and the twelve oxen under the sea;"
11007045,11,7,45,"and the pots, and the shovels, and the basins: even all these vessels, which Hiram made for king Solomon, in the house of Yahweh, were of burnished brass."
11007046,11,7,46,"In the plain of the Jordan did the king cast them, in the clay ground between Succoth and Zarethan."
11007047,11,7,47,"Solomon left all the vessels [unweighed], because they were exceeding many: the weight of the brass could not be found out."
11007048,11,7,48,"Solomon made all the vessels that were in the house of Yahweh: the golden altar, and the table whereupon the show bread was, of gold;"
11007049,11,7,49,"and the lampstands, five on the right side, and five on the left, before the oracle, of pure gold; and the flowers, and the lamps, and the tongs, of gold;"
11007050,11,7,50,"and the cups, and the snuffers, and the basins, and the spoons, and the fire pans, of pure gold; and the hinges, both for the doors of the inner house, the most holy place, and for the doors of the house, [to wit], of the temple, of gold."
11007051,11,7,51,"Thus all the work that king Solomon worked in the house of Yahweh was finished. Solomon brought in the things which David his father had dedicated, [even] the silver, and the gold, and the vessels, and put them in the treasuries of the house of Yahweh."
11008001,11,8,1,"Then Solomon assembled the elders of Israel, and all the heads of the tribes, the princes of the fathers' [houses] of the children of Israel, to king Solomon in Jerusalem, to bring up the ark of the covenant of Yahweh out of the city of David, which is Zion."
11008002,11,8,2,"All the men of Israel assembled themselves to king Solomon at the feast, in the month Ethanim, which is the seventh month."
11008003,11,8,3,"All the elders of Israel came, and the priests took up the ark."
11008004,11,8,4,"They brought up the ark of Yahweh, and the tent of meeting, and all the holy vessels that were in the Tent; even these did the priests and the Levites bring up."
11008005,11,8,5,"King Solomon and all the congregation of Israel, who were assembled to him, were with him before the ark, sacrificing sheep and oxen, that could not be counted nor numbered for multitude."
11008006,11,8,6,"The priests brought in the ark of the covenant of Yahweh to its place, into the oracle of the house, to the most holy place, even under the wings of the cherubim."
11008007,11,8,7,"For the cherubim spread forth their wings over the place of the ark, and the cherubim covered the ark and the poles of it above."
11008008,11,8,8,The poles were so long that the ends of the poles were seen from the holy place before the oracle; but they were not seen outside: and there they are to this day.
11008009,11,8,9,"There was nothing in the ark save the two tables of stone which Moses put there at Horeb, when Yahweh made a covenant with the children of Israel, when they came out of the land of Egypt."
11008010,11,8,10,"It came to pass, when the priests were come out of the holy place, that the cloud filled the house of Yahweh,"
11008011,11,8,11,so that the priests could not stand to minister by reason of the cloud; for the glory of Yahweh filled the house of Yahweh.
11008012,11,8,12,"Then spoke Solomon, Yahweh has said that he would dwell in the thick darkness."
11008013,11,8,13,"I have surely built you a house of habitation, a place for you to dwell in forever."
11008014,11,8,14,"The king turned his face about, and blessed all the assembly of Israel: and all the assembly of Israel stood."
11008015,11,8,15,"He said, Blessed be Yahweh, the God of Israel, who spoke with his mouth to David your father, and has with his hand fulfilled it, saying,"
11008016,11,8,16,"Since the day that I brought forth my people Israel out of Egypt, I chose no city out of all the tribes of Israel to build a house, that my name might be there; but I chose David to be over my people Israel."
11008017,11,8,17,"Now it was in the heart of David my father to build a house for the name of Yahweh, the God of Israel."
11008018,11,8,18,"But Yahweh said to David my father, Whereas it was in your heart to build a house for my name, you did well that it was in your heart:"
11008019,11,8,19,"nevertheless you shall not build the house; but your son who shall come forth out of your loins, he shall build the house for my name."
11008020,11,8,20,"Yahweh has established his word that he spoke; for I am risen up in the room of David my father, and sit on the throne of Israel, as Yahweh promised, and have built the house for the name of Yahweh, the God of Israel."
11008021,11,8,21,"There have I set a place for the ark, in which is the covenant of Yahweh, which he made with our fathers, when he brought them out of the land of Egypt."
11008022,11,8,22,"Solomon stood before the altar of Yahweh in the presence of all the assembly of Israel, and spread forth his hands toward heaven;"
11008023,11,8,23,"and he said, Yahweh, the God of Israel, there is no God like you, in heaven above, or on earth beneath; who keep covenant and loving kindness with your servants, who walk before you with all their heart;"
11008024,11,8,24,"who have kept with your servant David my father that which you did promise him: yes, you spoke with your mouth, and have fulfilled it with your hand, as it is this day."
11008025,11,8,25,"Now therefore, Yahweh, the God of Israel, keep with your servant David my father that which you have promised him, saying, There shall not fail you a man in my sight to sit on the throne of Israel, if only your children take heed to their way, to walk before me as you have walked before me."
11008026,11,8,26,"Now therefore, God of Israel, Please let your word be verified, which you spoke to your servant David my father."
11008027,11,8,27,"But will God in very deed dwell on the earth? behold, heaven and the heaven of heavens can't contain you; how much less this house that I have built!"
11008028,11,8,28,"Yet have respect for the prayer of your servant, and for his supplication, Yahweh my God, to listen to the cry and to the prayer which your servant prays before you this day;"
11008029,11,8,29,"that your eyes may be open toward this house night and day, even toward the place of which you have said, My name shall be there; to listen to the prayer which your servant shall pray toward this place."
11008030,11,8,30,"Listen you to the supplication of your servant, and of your people Israel, when they shall pray toward this place: yes, hear in heaven, your dwelling-place; and when you hear, forgive."
11008031,11,8,31,"If a man sin against his neighbor, and an oath be laid on him to cause him to swear, and he come [and] swear before your altar in this house;"
11008032,11,8,32,"then hear you in heaven, and do, and judge your servants, condemning the wicked, to bring his way on his own head, and justifying the righteous, to give him according to his righteousness."
11008033,11,8,33,"When your people Israel are struck down before the enemy, because they have sinned against you; if they turn again to you, and confess your name, and pray and make supplication to you in this house:"
11008034,11,8,34,"then hear you in heaven, and forgive the sin of your people Israel, and bring them again to the land which you gave to their fathers."
11008035,11,8,35,"When the sky is shut up, and there is no rain, because they have sinned against you; if they pray toward this place, and confess your name, and turn from their sin, when you do afflict them:"
11008036,11,8,36,"then hear in heaven, and forgive the sin of your servants, and of your people Israel, when you teach them the good way in which they should walk; and send rain on your land, which you have given to your people for an inheritance."
11008037,11,8,37,"If there be in the land famine, if there be pestilence, if there be blasting [or] mildew, locust [or] caterpillar; if their enemy besiege them in the land of their cities; whatever plague, whatever sickness there be;"
11008038,11,8,38,"whatever prayer and supplication be made by any man, [or] by all your people Israel, who shall know every man the plague of his own heart, and spread forth his hands toward this house:"
11008039,11,8,39,"then hear in heaven, your dwelling-place, and forgive, and do, and render to every man according to all his ways, whose heart you know; (for you, even you only, know the hearts of all the children of men;)"
11008040,11,8,40,that they may fear you all the days that they live in the land which you gave to our fathers.
11008041,11,8,41,"Moreover concerning the foreigner, who is not of your people Israel, when he shall come out of a far country for your name's sake"
11008042,11,8,42,"(for they shall hear of your great name, and of your mighty hand, and of your outstretched arm); when he shall come and pray toward this house;"
11008043,11,8,43,"hear in heaven, your dwelling-place, and do according to all that the foreigner calls to you for; that all the peoples of the earth may know your name, to fear you, as does your people Israel, and that they may know that this house which I have built is called by my name."
11008044,11,8,44,"If your people go out to battle against their enemy, by whatever way you shall send them, and they pray to Yahweh toward the city which you have chosen, and toward the house which I have built for your name;"
11008045,11,8,45,"then hear in heaven their prayer and their supplication, and maintain their cause."
11008046,11,8,46,"If they sin against you (for there is no man who doesn't sin), and you are angry with them, and deliver them to the enemy, so that they carry them away captive to the land of the enemy, far off or near;"
