id,b,c,v,t
11017014,11,17,14,"For thus says Yahweh, the God of Israel, The jar of meal shall not empty, neither shall the jar of oil fail, until the day that Yahweh sends rain on the earth."
11017015,11,17,15,"She went and did according to the saying of Elijah: and she, and he, and her house, ate [many] days."
11017016,11,17,16,"The jar of meal didn't empty, neither did the jar of oil fail, according to the word of Yahweh, which he spoke by Elijah."
11017017,11,17,17,"It happened after these things, that the son of the woman, the mistress of the house, fell sick; and his sickness was so sore, that there was no breath left in him."
11017018,11,17,18,"She said to Elijah, What have I to do with you, you man of God? You have come to me to bring my sin to memory, and to kill my son!"
11017019,11,17,19,"He said to her, Give me your son. He took him out of her bosom, and carried him up into the chamber, where he abode, and laid him on his own bed."
11017020,11,17,20,"He cried to Yahweh, and said, Yahweh my God, have you also brought evil on the widow with whom I sojourn, by killing her son?"
11017021,11,17,21,"He stretched himself on the child three times, and cried to Yahweh, and said, Yahweh my God, please let this child's soul come into him again."
11017022,11,17,22,"Yahweh listened to the voice of Elijah; and the soul of the child came into him again, and he revived."
11017023,11,17,23,"Elijah took the child, and brought him down out of the chamber into the house, and delivered him to his mother; and Elijah said, Behold, your son lives."
11017024,11,17,24,"The woman said to Elijah, Now I know that you are a man of God, and that the word of Yahweh in your mouth is truth."
11018001,11,18,1,"It happened after many days, that the word of Yahweh came to Elijah, in the third year, saying, Go, show yourself to Ahab; and I will send rain on the earth."
11018002,11,18,2,Elijah went to show himself to Ahab. The famine was sore in Samaria.
11018003,11,18,3,"Ahab called Obadiah, who was over the household. (Now Obadiah feared Yahweh greatly:"
11018004,11,18,4,"for it was so, when Jezebel cut off the prophets of Yahweh, that Obadiah took one hundred prophets, and hid them by fifty in a cave, and fed them with bread and water.)"
11018005,11,18,5,"Ahab said to Obadiah, Go through the land, to all the springs of water, and to all the brooks: peradventure we may find grass and save the horses and mules alive, that we not lose all the animals."
11018006,11,18,6,"So they divided the land between them to pass throughout it: Ahab went one way by himself, and Obadiah went another way by himself."
11018007,11,18,7,"As Obadiah was in the way, behold, Elijah met him: and he knew him, and fell on his face, and said, Is it you, my lord Elijah?"
11018008,11,18,8,"He answered him, It is I: go, tell your lord, Behold, Elijah [is here]."
11018009,11,18,9,"He said, Wherein have I sinned, that you would deliver your servant into the hand of Ahab, to kill me?"
11018010,11,18,10,"As Yahweh your God lives, there is no nation or kingdom, where my lord has not sent to seek you: and when they said, He is not here, he took an oath of the kingdom and nation, that they didn't find you."
11018011,11,18,11,"Now you say, Go, tell your lord, Behold, Elijah [is here]."
11018012,11,18,12,"It will happen, as soon as I am gone from you, that the Spirit of Yahweh will carry you I don't know where; and so when I come and tell Ahab, and he can't find you, he will kill me: but I your servant fear Yahweh from my youth."
11018013,11,18,13,"Wasn't it told my lord what I did when Jezebel killed the prophets of Yahweh, how I hid one hundred men of Yahweh's prophets by fifty in a cave, and fed them with bread and water?"
11018014,11,18,14,"Now you say, Go, tell your lord, Behold, Elijah [is here]; and he will kill me."
11018015,11,18,15,"Elijah said, As Yahweh of Hosts lives, before whom I stand, I will surely show myself to him today."
11018016,11,18,16,"So Obadiah went to meet Ahab, and told him; and Ahab went to meet Elijah."
11018017,11,18,17,"It happened, when Ahab saw Elijah, that Ahab said to him, Is it you, you troubler of Israel?"
11018018,11,18,18,"He answered, I have not troubled Israel; but you, and your father's house, in that you have forsaken the commandments of Yahweh, and you have followed the Baals."
11018019,11,18,19,"Now therefore send, and gather to me all Israel to Mount Carmel, and the prophets of Baal four hundred fifty, and the prophets of the Asherah four hundred, who eat at Jezebel's table."
11018020,11,18,20,"So Ahab sent to all the children of Israel, and gathered the prophets together to Mount Carmel."
11018021,11,18,21,"Elijah came near to all the people, and said, ""How long will you waver between the two sides? If Yahweh is God, follow him; but if Baal, then follow him."" The people answered him not a word."
11018022,11,18,22,"Then Elijah said to the people, ""I, even I only, am left a prophet of Yahweh; but Baal's prophets are four hundred fifty men."
11018023,11,18,23,"Let them therefore give us two bulls; and let them choose one bull for themselves, and cut it in pieces, and lay it on the wood, and put no fire under; and I will dress the other bull, and lay it on the wood, and put no fire under."
11018024,11,18,24,"You call on the name of your god, and I will call on the name of Yahweh; and the God who answers by fire, let him be God."" All the people answered, ""It is well said."""
11018025,11,18,25,"Elijah said to the prophets of Baal, ""Choose one bull for yourselves, and dress it first; for you are many; and call on the name of your god, but put no fire under it."""
11018026,11,18,26,"They took the bull which was given them, and they dressed it, and called on the name of Baal from morning even until noon, saying, Baal, hear us. But there was no voice, nor any who answered. They leaped about the altar which was made."
11018027,11,18,27,"It happened at noon, that Elijah mocked them, and said, Cry aloud; for he is a god: either he is musing, or he is gone aside, or he is on a journey, or peradventure he sleeps and must be awakened."
11018028,11,18,28,"They cried aloud, and cut themselves after their manner with knives and lances, until the blood gushed out on them."
11018029,11,18,29,"It was so, when midday was past, that they prophesied until the time of the offering of the [evening] offering; but there was neither voice, nor any to answer, nor any who regarded."
11018030,11,18,30,"Elijah said to all the people, Come near to me; and all the people came near to him. He repaired the altar of Yahweh that was thrown down."
11018031,11,18,31,"Elijah took twelve stones, according to the number of the tribes of the sons of Jacob, to whom the word of Yahweh came, saying, Israel shall be your name."
11018032,11,18,32,"With the stones he built an altar in the name of Yahweh; and he made a trench about the altar, as great as would contain two measures of seed."
11018033,11,18,33,"He put the wood in order, and cut the bull in pieces, and laid it on the wood. He said, Fill four jars with water, and pour it on the burnt offering, and on the wood."
11018034,11,18,34,"He said, Do it the second time; and they did it the second time. He said, Do it the third time; and they did it the third time."
11018035,11,18,35,The water ran round about the altar; and he filled the trench also with water.
11018036,11,18,36,"It happened at the time of the offering of the [evening] offering, that Elijah the prophet came near, and said, Yahweh, the God of Abraham, of Isaac, and of Israel, let it be known this day that you are God in Israel, and that I am your servant, and that I have done all these things at your word."
11018037,11,18,37,"Hear me, Yahweh, hear me, that this people may know that you, Yahweh, are God, and [that] you have turned their heart back again."
11018038,11,18,38,"Then the fire of Yahweh fell, and consumed the burnt offering, and the wood, and the stones, and the dust, and licked up the water that was in the trench."
11018039,11,18,39,"When all the people saw it, they fell on their faces: and they said, Yahweh, he is God; Yahweh, he is God."
11018040,11,18,40,"and Elijah said to them, Take the prophets of Baal; don't let one of them escape. They took them; and Elijah brought them down to the brook Kishon, and killed them there."
11018041,11,18,41,"Elijah said to Ahab, Get you up, eat and drink; for there is the sound of abundance of rain."
11018042,11,18,42,"So Ahab went up to eat and to drink. Elijah went up to the top of Carmel; and he bowed himself down on the earth, and put his face between his knees."
11018043,11,18,43,"He said to his servant, Go up now, look toward the sea. He went up, and looked, and said, There is nothing. He said, Go again seven times."
11018044,11,18,44,"It happened at the seventh time, that he said, ""Behold, a small cloud, like a man's hand, is rising out of the sea."" He said, Go up, tell Ahab, Make ready [your chariot], and get you down, that the rain not stop you."
11018045,11,18,45,"It happened in a little while, that the sky grew black with clouds and wind, and there was a great rain. Ahab rode, and went to Jezreel:"
11018046,11,18,46,"and the hand of Yahweh was on Elijah; and he girded up his loins, and ran before Ahab to the entrance of Jezreel."
11019001,11,19,1,"Ahab told Jezebel all that Elijah had done, and withal how he had slain all the prophets with the sword."
11019002,11,19,2,"Then Jezebel send a messenger to Elijah, saying, So let the gods do to me, and more also, if I don't make your life as the life of one of them by tomorrow about this time."
11019003,11,19,3,"When he saw that, he arose, and went for his life, and came to Beersheba, which belongs to Judah, and left his servant there."
11019004,11,19,4,"But he himself went a day's journey into the wilderness, and came and sat down under a juniper tree: and he requested for himself that he might die, and said, It is enough; now, O Yahweh, take away my life; for I am not better than my fathers."
11019005,11,19,5,"He lay down and slept under a juniper tree; and, behold, an angel touched him, and said to him, Arise and eat."
11019006,11,19,6,"He looked, and, behold, there was at his head a cake baked on the coals, and a jar of water. He ate and drink, and laid him down again."
11019007,11,19,7,"The angel of Yahweh came again the second time, and touched him, and said, Arise and eat, because the journey is too great for you."
11019008,11,19,8,"He arose, and ate and drink, and went in the strength of that food forty days and forty nights to Horeb the Mount of God."
11019009,11,19,9,"He came there to a cave, and lodged there; and, behold, the word of Yahweh came to him, and he said to him, What are you doing here, Elijah?"
11019010,11,19,10,"He said, I have been very jealous for Yahweh, the God of hosts; for the children of Israel have forsaken your covenant, thrown down your altars, and slain your prophets with the sword: and I, even I only, am left; and they seek my life, to take it away."
11019011,11,19,11,"He said, Go forth, and stand on the mountain before Yahweh. Behold, Yahweh passed by, and a great and strong wind tore the mountains, and broke in pieces the rocks before Yahweh; but Yahweh was not in the wind: and after the wind an earthquake; but Yahweh was not in the earthquake:"
11019012,11,19,12,and after the earthquake a fire; but Yahweh was not in the fire: and after the fire a still small voice.
11019013,11,19,13,"It was so, when Elijah heard it, that he wrapped his face in his mantle, and went out, and stood in the entrance of the cave. Behold, there came a voice to him, and said, What are you doing here, Elijah?"
11019014,11,19,14,"He said, I have been very jealous for Yahweh, the God of hosts; for the children of Israel have forsaken your covenant, thrown down your altars, and slain your prophets with the sword; and I, even I only, am left; and they seek my life, to take it away."
11019015,11,19,15,"Yahweh said to him, Go, return on your way to the wilderness of Damascus: and when you come, you shall anoint Hazael to be king over Syria;"
11019016,11,19,16,and Jehu the son of Nimshi shall you anoint to be king over Israel; and Elisha the son of Shaphat of Abel Meholah shall you anoint to be prophet in your room.
11019017,11,19,17,"It shall happen, that he who escapes from the sword of Hazael shall Jehu kill; and he who escapes from the sword of Jehu shall Elisha kill."
11019018,11,19,18,"Yet will I leave [me] seven thousand in Israel, all the knees which have not bowed to Baal, and every mouth which has not kissed him."
11019019,11,19,19,"So he departed there, and found Elisha the son of Shaphat, who was plowing, with twelve yoke [of oxen] before him, and he with the twelfth: and Elijah passed over to him, and cast his mantle on him."
11019020,11,19,20,"He left the oxen, and ran after Elijah, and said, Let me, I pray you, kiss my father and my mother, and then I will follow you. He said to him, Go back again; for what have I done to you?"
11019021,11,19,21,"He returned from following him, and took the yoke of oxen, and killed them, and boiled their flesh with the instruments of the oxen, and gave to the people, and they ate. Then he arose, and went after Elijah, and ministered to him."
11020001,11,20,1,"Ben Hadad the king of Syria gathered all his host together; and there were thirty-two kings with him, and horses and chariots: and he went up and besieged Samaria, and fought against it."
11020002,11,20,2,"He sent messengers to Ahab king of Israel, into the city, and said to him, Thus says Ben Hadad,"
11020003,11,20,3,"Your silver and your gold is mine; your wives also and your children, even the best, are mine."
11020004,11,20,4,"The king of Israel answered, It is according to your saying, my lord, O king; I am yours, and all that I have."
11020005,11,20,5,"The messengers came again, and said, Thus speaks Ben Hadad, saying, I sent indeed to you, saying, You shall deliver me your silver, and your gold, and your wives, and your children;"
11020006,11,20,6,"but I will send my servants to you tomorrow about this time, and they shall search your house, and the houses of your servants; and it shall be, that whatever is pleasant in your eyes, they shall put it in their hand, and take it away."
11020007,11,20,7,"Then the king of Israel called all the elders of the land, and said, Please notice how this man seeks mischief: for he sent to me for my wives, and for my children, and for my silver, and for my gold; and I didn't deny him."
11020008,11,20,8,"All the elders and all the people said to him, Don't you listen, neither consent."
11020009,11,20,9,"Therefore he said to the messengers of Ben Hadad, Tell my lord the king, All that you did send for to your servant at the first I will do; but this thing I may not do. The messengers departed, and brought him word again."
11020010,11,20,10,"Ben Hadad sent to him, and said, The gods do so to me, and more also, if the dust of Samaria shall suffice for handfuls for all the people who follow me."
11020011,11,20,11,"The king of Israel answered, Tell him, Don't let him who girds on [his armor] boast himself as he who puts it off."
11020012,11,20,12,"It happened, when [Ben Hadad] heard this message, as he was drinking, he and the kings, in the pavilions, that he said to his servants, Set [yourselves in array]. They set [themselves in array] against the city."
11020013,11,20,13,"Behold, a prophet came near to Ahab king of Israel, and said, Thus says Yahweh, Have you seen all this great multitude? behold, I will deliver it into your hand this day; and you shall know that I am Yahweh."
11020014,11,20,14,"Ahab said, By whom? He said, Thus says Yahweh, By the young men of the princes of the provinces. Then he said, Who shall begin the battle? He answered, You."
11020015,11,20,15,"Then he mustered the young men of the princes of the provinces, and they were two hundred and thirty-two: and after them he mustered all the people, even all the children of Israel, being seven thousand."
11020016,11,20,16,"They went out at noon. But Ben Hadad was drinking himself drunk in the pavilions, he and the kings, the thirty-two kings who helped him."
11020017,11,20,17,"The young men of the princes of the provinces went out first; and Ben Hadad sent out, and they told him, saying, There are men come out from Samaria."
11020018,11,20,18,"He said, Whether they are come out for peace, take them alive, or whether they are come out for war, taken them alive."
11020019,11,20,19,"So these went out of the city, the young men of the princes of the provinces, and the army which followed them."
11020020,11,20,20,"They killed everyone his man; and the Syrians fled, and Israel pursued them: and Ben Hadad the king of Syria escaped on a horse with horsemen."
11020021,11,20,21,"The king of Israel went out, and struck the horses and chariots, and killed the Syrians with a great slaughter."
11020022,11,20,22,"The prophet came near to the king of Israel, and said to him, Go, strengthen yourself, and mark, and see what you do; for at the return of the year the king of Syria will come up against you."
11020023,11,20,23,"The servants of the king of Syria said to him, Their god is a god of the hills; therefore they were stronger than we: but let us fight against them in the plain, and surely we shall be stronger than they."
11020024,11,20,24,"Do this thing: take the kings away, every man out of his place, and put captains in their room;"
11020025,11,20,25,"and number you an army, like the army that you have lost, horse for horse, and chariot for chariot; and we will fight against them in the plain, and surely we shall be stronger than they. He listened to their voice, and did so."
11020026,11,20,26,"It happened at the return of the year, that Ben Hadad mustered the Syrians, and went up to Aphek, to fight against Israel."
11020027,11,20,27,"The children of Israel were mustered, and were provisioned, and went against them: and the children of Israel encamped before them like two little flocks of kids; but the Syrians filled the country."
11020028,11,20,28,"A man of God came near and spoke to the king of Israel, and said, Thus says Yahweh, Because the Syrians have said, Yahweh is a god of the hills, but he is not a god of the valleys; therefore will I deliver all this great multitude into your hand, and you shall know that I am Yahweh."
11020029,11,20,29,"They encamped one over against the other seven days. So it was, that in the seventh day the battle was joined; and the children of Israel killed of the Syrians one hundred thousand footmen in one day."
11020030,11,20,30,"But the rest fled to Aphek, into the city; and the wall fell on twenty-seven thousand men who were left. Ben Hadad fled, and came into the city, into an inner chamber."
11020031,11,20,31,"His servants said to him, See now, we have heard that the kings of the house of Israel are merciful kings: let us, we pray you, put sackcloth on our loins, and ropes on our heads, and go out to the king of Israel: peradventure he will save your life."
11020032,11,20,32,"So they girded sackcloth on their loins, and [put] ropes on their heads, and came to the king of Israel, and said, Your servant Ben Hadad says, please let me live. He said, Is he yet alive? he is my brother."
11020033,11,20,33,"Now the men observed diligently, and hurried to catch whether it were his mind; and they said, Your brother Ben Hadad. Then he said, Go you, bring him. Then Ben Hadad came forth to him; and he caused him to come up into the chariot."
11020034,11,20,34,"[Ben Hadad] said to him, The cities which my father took from your father I will restore; and you shall make streets for you in Damascus, as my father made in Samaria. I, [said Ahab], will let you go with this covenant. So he made a covenant with him, and let him go."
11020035,11,20,35,"A certain man of the sons of the prophets said to his fellow by the word of Yahweh, Please strike me. The man refused to strike him."
11020036,11,20,36,"Then said he to him, Because you have not obeyed the voice of Yahweh, behold, as soon as you are departed from me, a lion shall kill you. As soon as he was departed from him, a lion found him, and killed him."
11020037,11,20,37,"Then he found another man, and said, Please strike me. The man struck him, smiting and wounding him."
11020038,11,20,38,"So the prophet departed, and waited for the king by the way, and disguised himself with his headband over his eyes."
11020039,11,20,39,"As the king passed by, he cried to the king; and he said, Your servant went out into the midst of the battle; and, behold, a man turned aside, and brought a man to me, and said, Keep this man: if by any means he be missing, then shall your life be for his life, or else you shall pay a talent of silver."
11020040,11,20,40,"As your servant was busy here and there, he was gone. The king of Israel said to him, So shall your judgment be; yourself have decided it."
11020041,11,20,41,"He hurried, and took the headband away from his eyes; and the king of Israel discerned him that he was of the prophets."
11020042,11,20,42,"He said to him, Thus says Yahweh, Because you have let go out of your hand the man whom I had devoted to destruction, therefore your life shall go for his life, and your people for his people."
11020043,11,20,43,"The king of Israel went to his house sullen and angry, and came to Samaria."
11021001,11,21,1,"It happened after these things, that Naboth the Jezreelite had a vineyard, which was in Jezreel, hard by the palace of Ahab king of Samaria."
11021002,11,21,2,"Ahab spoke to Naboth, saying, Give me your vineyard, that I may have it for a garden of herbs, because it is near to my house; and I will give you for it a better vineyard than it: or, if it seem good to you, I will give you the worth of it in money."
11021003,11,21,3,"Naboth said to Ahab, Yahweh forbid it me, that I should give the inheritance of my fathers to you."
11021004,11,21,4,"Ahab came into his house sullen and angry because of the word which Naboth the Jezreelite had spoken to him; for he had said, I will not give you the inheritance of my fathers. He laid him down on his bed, and turned away his face, and would eat no bread."
11021005,11,21,5,"But Jezebel his wife came to him, and said to him, Why is your spirit so sad, that you eat no bread?"
11021006,11,21,6,"He said to her, Because I spoke to Naboth the Jezreelite, and said to him, Give me your vineyard for money; or else, if it please you, I will give you [another] vineyard for it: and he answered, I will not give you my vineyard."
11021007,11,21,7,"Jezebel his wife said to him, Do you now govern the kingdom of Israel? arise, and eat bread, and let your heart be merry: I will give you the vineyard of Naboth the Jezreelite."
11021008,11,21,8,"So she wrote letters in Ahab's name, and sealed them with his seal, and sent the letters to the elders and to the nobles who were in his city, [and] who lived with Naboth."
11021009,11,21,9,"She wrote in the letters, saying, Proclaim a fast, and set Naboth on high among the people:"
11021010,11,21,10,"and set two men, base fellows, before him, and let them testify against him, saying, You did curse God and the king. Then carry him out, and stone him to death."
11021011,11,21,11,"The men of his city, even the elders and the nobles who lived in his city, did as Jezebel had sent to them, according as it was written in the letters which she had sent to them."
11021012,11,21,12,"They proclaimed a fast, and set Naboth on high among the people."
11021013,11,21,13,"The two men, the base fellows, came in and sat before him: and the base fellows bore witness against him, even against Naboth, in the presence of the people, saying, Naboth did curse God and the king. Then they carried him forth out of the city, and stoned him to death with stones."
11021014,11,21,14,"Then they sent to Jezebel, saying, Naboth is stoned, and is dead."
11021015,11,21,15,"It happened, when Jezebel heard that Naboth was stoned, and was dead, that Jezebel said to Ahab, Arise, take possession of the vineyard of Naboth the Jezreelite, which he refused to give you for money; for Naboth is not alive, but dead."
11021016,11,21,16,"It happened, when Ahab heard that Naboth was dead, that Ahab rose up to go down to the vineyard of Naboth the Jezreelite, to take possession of it."
11021017,11,21,17,"The word of Yahweh came to Elijah the Tishbite, saying,"
11021018,11,21,18,"Arise, go down to meet Ahab king of Israel, who dwells in Samaria: behold, he is in the vineyard of Naboth, where he is gone down to take possession of it."
11021019,11,21,19,"You shall speak to him, saying, Thus says Yahweh, Have you killed and also taken possession? You shall speak to him, saying, Thus says Yahweh, In the place where dogs licked the blood of Naboth shall dogs lick your blood, even yours."
11021020,11,21,20,"Ahab said to Elijah, Have you found me, my enemy? He answered, I have found you, because you have sold yourself to do that which is evil in the sight of Yahweh."
11021021,11,21,21,"Behold, I will bring evil on you, and will utterly sweep you away and will cut off from Ahab every man-child, and him who is shut up and him who is left at large in Israel:"
11021022,11,21,22,"and I will make your house like the house of Jeroboam the son of Nebat, and like the house of Baasha the son of Ahijah for the provocation with which you have provoked me to anger, and have made Israel to sin."
11021023,11,21,23,"Of Jezebel also spoke Yahweh, saying, The dogs shall eat Jezebel by the rampart of Jezreel."
11021024,11,21,24,Him who dies of Ahab in the city the dogs shall eat; and him who dies in the field shall the birds of the sky eat.
11021025,11,21,25,"(But there was none like Ahab, who did sell himself to do that which was evil in the sight of Yahweh, whom Jezebel his wife stirred up."
