id,b,c,v,t
2029038,2,29,38,"""Now this is that which you shall offer on the altar: two lambs a year old day by day continually."
2029039,2,29,39,The one lamb you shall offer in the morning; and the other lamb you shall offer at evening:
2029040,2,29,40,"and with the one lamb a tenth part of an ephah of fine flour mixed with the fourth part of a hin of beaten oil, and the fourth part of a hin of wine for a drink-offering."
2029041,2,29,41,"The other lamb you shall offer at evening, and shall do to it according to the meal-offering of the morning, and according to its drink-offering, for a sweet savor, an offering made by fire to Yahweh."
2029042,2,29,42,"It shall be a continual burnt offering throughout your generations at the door of the tent of meeting before Yahweh, where I will meet with you, to speak there to you."
2029043,2,29,43,There I will meet with the children of Israel; and the place shall be sanctified by my glory.
2029044,2,29,44,"I will sanctify the tent of meeting and the altar: Aaron also and his sons I will sanctify, to minister to me in the priest's office."
2029045,2,29,45,"I will dwell among the children of Israel, and will be their God."
2029046,2,29,46,"They shall know that I am Yahweh their God, who brought them forth out of the land of Egypt, that I might dwell among them: I am Yahweh their God."
2030001,2,30,1,"""You shall make an altar to burn incense on. You shall make it of acacia wood."
2030002,2,30,2,"Its length shall be a cubit, and its breadth a cubit. It shall be square, and its height shall be two cubits. Its horns shall be of one piece with it."
2030003,2,30,3,"You shall overlay it with pure gold, the top of it, the sides of it around it, and its horns; and you shall make a gold molding around it."
2030004,2,30,4,"You shall make two golden rings for it under its molding; on its two ribs, on its two sides you shall make them; and they shall be for places for poles with which to bear it."
2030005,2,30,5,"You shall make the poles of acacia wood, and overlay them with gold."
2030006,2,30,6,"You shall put it before the veil that is by the ark of the testimony, before the mercy seat that is over the testimony, where I will meet with you."
2030007,2,30,7,"Aaron shall burn incense of sweet spices on it every morning. When he tends the lamps, he shall burn it."
2030008,2,30,8,"When Aaron lights the lamps at evening, he shall burn it, a perpetual incense before Yahweh throughout your generations."
2030009,2,30,9,"You shall offer no strange incense on it, nor burnt offering, nor meal-offering; and you shall pour no drink-offering on it."
2030010,2,30,10,"Aaron shall make atonement on its horns once in the year; with the blood of the sin offering of atonement once in the year he shall make atonement for it throughout your generations. It is most holy to Yahweh."""
2030011,2,30,11,"Yahweh spoke to Moses, saying,"
2030012,2,30,12,"""When you take a census of the children of Israel, according to those who are numbered among them, then each man shall give a ransom for his soul to Yahweh, when you number them; that there be no plague among them when you number them."
2030013,2,30,13,"They shall give this, everyone who passes over to those who are numbered, half a shekel after the shekel of the sanctuary; (the shekel is twenty gerahs;) half a shekel for an offering to Yahweh."
2030014,2,30,14,"Everyone who passes over to those who are numbered, from twenty years old and upward, shall give the offering to Yahweh."
2030015,2,30,15,"The rich shall not give more, and the poor shall not give less, than the half shekel, when they give the offering of Yahweh, to make atonement for your souls."
2030016,2,30,16,"You shall take the atonement money from the children of Israel, and shall appoint it for the service of the tent of meeting; that it may be a memorial for the children of Israel before Yahweh, to make atonement for your souls."""
2030017,2,30,17,"Yahweh spoke to Moses, saying,"
2030018,2,30,18,"""You shall also make a basin of brass, and the base of it of brass, in which to wash. You shall put it between the tent of meeting and the altar, and you shall put water in it."
2030019,2,30,19,Aaron and his sons shall wash their hands and their feet in it.
2030020,2,30,20,"When they go into the tent of meeting, they shall wash with water, that they not die; or when they come near to the altar to minister, to burn an offering made by fire to Yahweh."
2030021,2,30,21,"So they shall wash their hands and their feet, that they not die: and it shall be a statute forever to them, even to him and to his descendants throughout their generations."""
2030022,2,30,22,"Moreover Yahweh spoke to Moses, saying,"
2030023,2,30,23,"""Also take fine spices: of liquid myrrh, five hundred shekels; and of fragrant cinnamon half as much, even two hundred and fifty; and of fragrant cane, two hundred and fifty;"
2030024,2,30,24,"and of cassia five hundred, after the shekel of the sanctuary; and a hin of olive oil."
2030025,2,30,25,"You shall make it a holy anointing oil, a perfume compounded after the art of the perfumer: it shall be a holy anointing oil."
2030026,2,30,26,"You shall use it to anoint the tent of meeting, the ark of the testimony,"
2030027,2,30,27,"the table and all its articles, the lampstand and its accessories, the altar of incense,"
2030028,2,30,28,"the altar of burnt offering with all its utensils, and the basin with its base."
2030029,2,30,29,"You shall sanctify them, that they may be most holy. Whatever touches them shall be holy."
2030030,2,30,30,"You shall anoint Aaron and his sons, and sanctify them, that they may minister to me in the priest's office."
2030031,2,30,31,"You shall speak to the children of Israel, saying, 'This shall be a holy anointing oil to me throughout your generations."
2030032,2,30,32,"It shall not be poured on man's flesh, neither shall you make any like it, according to its composition: it is holy. It shall be holy to you."
2030033,2,30,33,"Whoever compounds any like it, or whoever puts any of it on a stranger, he shall be cut off from his people.'"""
2030034,2,30,34,"Yahweh said to Moses, ""Take to yourself sweet spices, gum resin, and onycha, and galbanum; sweet spices with pure frankincense: of each shall there be an equal weight;"
2030035,2,30,35,"and you shall make incense of it, a perfume after the art of the perfumer, seasoned with salt, pure and holy:"
2030036,2,30,36,"and you shall beat some of it very small, and put some of it before the testimony in the tent of meeting, where I will meet with you. It shall be to you most holy."
2030037,2,30,37,"The incense which you shall make, according to its composition you shall not make for yourselves: it shall be to you holy for Yahweh."
2030038,2,30,38,"Whoever shall make any like that, to smell of it, he shall be cut off from his people."""
2031001,2,31,1,"Yahweh spoke to Moses, saying,"
2031002,2,31,2,"""Behold, I have called by name Bezalel the son of Uri, the son of Hur, of the tribe of Judah:"
2031003,2,31,3,"and I have filled him with the Spirit of God, in wisdom, and in understanding, and in knowledge, and in all manner of workmanship,"
2031004,2,31,4,"to devise skillful works, to work in gold, and in silver, and in brass,"
2031005,2,31,5,"and in cutting of stones for setting, and in carving of wood, to work in all manner of workmanship."
2031006,2,31,6,"I, behold, I have appointed with him Oholiab, the son of Ahisamach, of the tribe of Dan; and in the heart of all who are wise-hearted I have put wisdom, that they may make all that I have commanded you:"
2031007,2,31,7,"the tent of meeting, the ark of the testimony, the mercy seat that is on it, all the furniture of the Tent,"
2031008,2,31,8,"the table and its vessels, the pure lampstand with all its vessels, the altar of incense,"
2031009,2,31,9,"the altar of burnt offering with all its vessels, the basin and its base,"
2031010,2,31,10,"the finely worked garments--the holy garments for Aaron the priest--the garments of his sons to minister in the priest's office,"
2031011,2,31,11,"the anointing oil, and the incense of sweet spices for the holy place: according to all that I have commanded you they shall do."""
2031012,2,31,12,"Yahweh spoke to Moses, saying,"
2031013,2,31,13,"""Speak also to the children of Israel, saying, 'Most assuredly you shall keep my Sabbaths: for it is a sign between me and you throughout your generations; that you may know that I am Yahweh who sanctifies you."
2031014,2,31,14,"You shall keep the Sabbath therefore; for it is holy to you. Everyone who profanes it shall surely be put to death; for whoever does any work therein, that soul shall be cut off from among his people."
2031015,2,31,15,"Six days shall work be done, but on the seventh day is a Sabbath of solemn rest, holy to Yahweh. Whoever does any work on the Sabbath day shall surely be put to death."
2031016,2,31,16,"Therefore the children of Israel shall keep the Sabbath, to observe the Sabbath throughout their generations, for a perpetual covenant."
2031017,2,31,17,"It is a sign between me and the children of Israel forever; for in six days Yahweh made heaven and earth, and on the seventh day he rested, and was refreshed.'"""
2031018,2,31,18,"He gave to Moses, when he finished speaking with him on Mount Sinai, the two tablets of the testimony, stone tablets, written with God's finger."
2032001,2,32,1,"When the people saw that Moses delayed to come down from the mountain, the people gathered themselves together to Aaron, and said to him, ""Come, make us gods, which shall go before us; for as for this Moses, the man who brought us up out of the land of Egypt, we don't know what has become of him."""
2032002,2,32,2,"Aaron said to them, ""Take off the golden rings, which are in the ears of your wives, of your sons, and of your daughters, and bring them to me."""
2032003,2,32,3,"All the people took off the golden rings which were in their ears, and brought them to Aaron."
2032004,2,32,4,"He received what they handed him, and fashioned it with an engraving tool, and made it a molten calf; and they said, ""These are your gods, Israel, which brought you up out of the land of Egypt."""
2032005,2,32,5,"When Aaron saw this, he built an altar before it; and Aaron made a proclamation, and said, ""Tomorrow shall be a feast to Yahweh."""
2032006,2,32,6,"They rose up early on the next day, and offered burnt offerings, and brought peace-offerings; and the people sat down to eat and to drink, and rose up to play."
2032007,2,32,7,"Yahweh spoke to Moses, ""Go, get down; for your people, who you brought up out of the land of Egypt, have corrupted themselves!"
2032008,2,32,8,"They have turned aside quickly out of the way which I commanded them. They have made themselves a molten calf, and have worshiped it, and have sacrificed to it, and said, 'These are your gods, Israel, which brought you up out of the land of Egypt.'"""
2032009,2,32,9,"Yahweh said to Moses, ""I have seen these people, and, behold, they are a stiff-necked people."
2032010,2,32,10,"Now therefore leave me alone, that my wrath may burn hot against them, and that I may consume them; and I will make of you a great nation."""
2032011,2,32,11,"Moses begged Yahweh his God, and said, ""Yahweh, why does your wrath burn hot against your people, that you have brought forth out of the land of Egypt with great power and with a mighty hand?"
2032012,2,32,12,"Why should the Egyptians speak, saying, 'He brought them forth for evil, to kill them in the mountains, and to consume them from the surface of the earth?' Turn from your fierce wrath, and repent of this evil against your people."
2032013,2,32,13,"Remember Abraham, Isaac, and Israel, your servants, to whom you swore by your own self, and said to them, 'I will multiply your seed as the stars of the sky, and all this land that I have spoken of I will give to your seed, and they shall inherit it forever.'"""
2032014,2,32,14,Yahweh repented of the evil which he said he would do to his people.
2032015,2,32,15,"Moses turned, and went down from the mountain, with the two tablets of the testimony in his hand; tablets that were written on both their sides; on the one side and on the other they were written."
2032016,2,32,16,"The tablets were the work of God, and the writing was the writing of God, engraved on the tables."
2032017,2,32,17,"When Joshua heard the noise of the people as they shouted, he said to Moses, ""There is the noise of war in the camp."""
2032018,2,32,18,"He said, ""It isn't the voice of those who shout for victory, neither is it the voice of those who cry for being overcome; but the noise of those who sing that I hear."""
2032019,2,32,19,"It happened, as soon as he came near to the camp, that he saw the calf and the dancing: and Moses' anger grew hot, and he threw the tablets out of his hands, and broke them beneath the mountain."
2032020,2,32,20,"He took the calf which they had made, and burnt it with fire, ground it to powder, and scattered it on the water, and made the children of Israel drink of it."
2032021,2,32,21,"Moses said to Aaron, ""What did these people do to you, that you have brought a great sin on them?"""
2032022,2,32,22,"Aaron said, ""Don't let the anger of my lord grow hot. You know the people, that they are set on evil."
2032023,2,32,23,"For they said to me, 'Make us gods, which shall go before us; for as for this Moses, the man who brought us up out of the land of Egypt, we don't know what has become of him.'"
2032024,2,32,24,"I said to them, 'Whoever has any gold, let them take it off:' so they gave it me; and I threw it into the fire, and out came this calf."""
2032025,2,32,25,"When Moses saw that the people had broken loose, (for Aaron had let them loose for a derision among their enemies),"
2032026,2,32,26,"then Moses stood in the gate of the camp, and said, ""Whoever is on Yahweh's side, come to me!"" All the sons of Levi gathered themselves together to him."
2032027,2,32,27,"He said to them, ""Thus says Yahweh, the God of Israel, 'Every man put his sword on his thigh, and go back and forth from gate to gate throughout the camp, and every man kill his brother, and every man his companion, and every man his neighbor."""
2032028,2,32,28,The sons of Levi did according to the word of Moses: and there fell of the people that day about three thousand men.
2032029,2,32,29,"Moses said, ""Consecrate yourselves today to Yahweh, yes, every man against his son, and against his brother; that he may bestow on you a blessing this day."""
2032030,2,32,30,"It happened on the next day, that Moses said to the people, ""You have sinned a great sin. Now I will go up to Yahweh. Perhaps I shall make atonement for your sin."""
2032031,2,32,31,"Moses returned to Yahweh, and said, ""Oh, this people have sinned a great sin, and have made themselves gods of gold."
2032032,2,32,32,"Yet now, if you will, forgive their sin-- and if not, please blot me out of your book which you have written."""
2032033,2,32,33,"Yahweh said to Moses, ""Whoever has sinned against me, him will I blot out of my book."
2032034,2,32,34,"Now go, lead the people to the place of which I have spoken to you. Behold, my angel shall go before you. Nevertheless in the day when I punish, I will punish them for their sin."""
2032035,2,32,35,"Yahweh struck the people, because they made the calf, which Aaron made."
2033001,2,33,1,"Yahweh spoke to Moses, ""Depart, go up from here, you and the people that you have brought up out of the land of Egypt, to the land of which I swore to Abraham, to Isaac, and to Jacob, saying, 'I will give it to your seed.'"
2033002,2,33,2,"I will send an angel before you; and I will drive out the Canaanite, the Amorite, and the Hittite, and the Perizzite, the Hivite, and the Jebusite:"
2033003,2,33,3,"to a land flowing with milk and honey: for I will not go up in the midst of you, for you are a stiff-necked people, lest I consume you in the way."""
2033004,2,33,4,"When the people heard this evil news, they mourned: and no one put on his jewelry."
2033005,2,33,5,"Yahweh said to Moses, ""Tell the children of Israel, 'You are a stiff-necked people. If I were to go up into your midst for one moment, I would consume you. Therefore now take off your jewelry from you, that I may know what to do to you."""
2033006,2,33,6,The children of Israel stripped themselves of their jewelry from Mount Horeb onward.
2033007,2,33,7,"Now Moses used to take the tent and to pitch it outside the camp, far away from the camp, and he called it ""The tent of meeting."" It happened that everyone who sought Yahweh went out to the tent of meeting, which was outside the camp."
2033008,2,33,8,"It happened that when Moses went out to the Tent, that all the people rose up, and stood, everyone at their tent door, and watched Moses, until he had gone into the Tent."
2033009,2,33,9,"It happened, when Moses entered into the Tent, that the pillar of cloud descended, stood at the door of the Tent, and spoke with Moses."
2033010,2,33,10,"All the people saw the pillar of cloud stand at the door of the Tent, and all the people rose up and worshiped, everyone at their tent door."
2033011,2,33,11,"Yahweh spoke to Moses face to face, as a man speaks to his friend. He turned again into the camp, but his servant Joshua, the son of Nun, a young man, didn't depart out of the Tent."
2033012,2,33,12,"Moses said to Yahweh, ""Behold, you tell me, 'Bring up this people:' and you haven't let me know whom you will send with me. Yet you have said, 'I know you by name, and you have also found favor in my sight.'"
2033013,2,33,13,"Now therefore, if I have found favor in your sight, please show me now your ways, that I may know you, so that I may find favor in your sight: and consider that this nation is your people."""
2033014,2,33,14,"He said, ""My presence will go with you, and I will give you rest."""
2033015,2,33,15,"He said to him, ""If your presence doesn't go with me, don't carry us up from here."
2033016,2,33,16,"For how would people know that I have found favor in your sight, I and your people? Isn't it in that you go with us, so that we are separated, I and your people, from all the people who are on the surface of the earth?"""
2033017,2,33,17,"Yahweh said to Moses, ""I will do this thing also that you have spoken; for you have found favor in my sight, and I know you by name."""
2033018,2,33,18,"He said, ""Please show me your glory."""
2033019,2,33,19,"He said, ""I will make all my goodness pass before you, and will proclaim the name of Yahweh before you. I will be gracious to whom I will be gracious, and will show mercy on whom I will show mercy."""
2033020,2,33,20,"He said, ""You cannot see my face, for man may not see me and live."""
2033021,2,33,21,"Yahweh also said, ""Behold, there is a place by me, and you shall stand on the rock."
2033022,2,33,22,"It will happen, while my glory passes by, that I will put you in a cleft of the rock, and will cover you with my hand until I have passed by;"
2033023,2,33,23,"then I will take away my hand, and you will see my back; but my face shall not be seen."""
2034001,2,34,1,"Yahweh said to Moses, ""Chisel two stone tablets like the first: and I will write on the tablets the words that were on the first tablets, which you broke."
2034002,2,34,2,"Be ready by the morning, and come up in the morning to Mount Sinai, and present yourself there to me on the top of the mountain."
2034003,2,34,3,"No one shall come up with you; neither let anyone be seen throughout all the mountain; neither let the flocks nor herds feed before that mountain."""
2034004,2,34,4,"He chiseled two tablets of stone like the first; and Moses rose up early in the morning, and went up to Mount Sinai, as Yahweh had commanded him, and took in his hand two stone tablets."
2034005,2,34,5,"Yahweh descended in the cloud, and stood with him there, and proclaimed the name of Yahweh."
2034006,2,34,6,"Yahweh passed by before him, and proclaimed, ""Yahweh! Yahweh, a merciful and gracious God, slow to anger, and abundant in loving kindness and truth,"
2034007,2,34,7,"keeping loving kindness for thousands, forgiving iniquity and disobedience and sin; and that will by no means clear the guilty, visiting the iniquity of the fathers on the children, and on the children's children, on the third and on the fourth generation."""
2034008,2,34,8,"Moses hurried and bowed his head toward the earth, and worshiped."
2034009,2,34,9,"He said, ""If now I have found favor in your sight, Lord, please let the Lord go in the midst of us; although this is a stiff-necked people; pardon our iniquity and our sin, and take us for your inheritance."""
2034010,2,34,10,"He said, ""Behold, I make a covenant: before all your people I will do marvels, such as have not been worked in all the earth, nor in any nation; and all the people among which you are shall see the work of Yahweh; for it is an awesome thing that I do with you."
2034011,2,34,11,"Observe that which I command you this day. Behold, I drive out before you the Amorite, the Canaanite, the Hittite, the Perizzite, the Hivite, and the Jebusite."
2034012,2,34,12,"Be careful, lest you make a covenant with the inhabitants of the land where you are going, lest it be for a snare in the midst of you:"
2034013,2,34,13,"but you shall break down their altars, and dash in pieces their pillars, and you shall cut down their Asherim;"
2034014,2,34,14,"for you shall worship no other god: for Yahweh, whose name is Jealous, is a jealous God."
2034015,2,34,15,"Don't make a covenant with the inhabitants of the land, lest they play the prostitute after their gods, and sacrifice to their gods, and one call you and you eat of his sacrifice;"
2034016,2,34,16,"and you take of their daughters to your sons, and their daughters play the prostitute after their gods, and make your sons play the prostitute after their gods."
2034017,2,34,17,You shall make no cast idols for yourselves.
2034018,2,34,18,"""You shall keep the feast of unleavened bread. Seven days you shall eat unleavened bread, as I commanded you, at the time appointed in the month Abib; for in the month Abib you came out from Egypt."
2034019,2,34,19,"All that opens the womb is mine; and all your cattle that is male, the firstborn of cow and sheep."
2034020,2,34,20,"The firstborn of a donkey you shall redeem with a lamb: and if you will not redeem it, then you shall break its neck. All the firstborn of your sons you shall redeem. No one shall appear before me empty."
2034021,2,34,21,"Six days you shall work, but on the seventh day you shall rest: in plowing time and in harvest you shall rest."
2034022,2,34,22,"You shall observe the feast of weeks with the first fruits of wheat harvest, and the feast of harvest at the year's end."
2034023,2,34,23,"Three times in the year all your males shall appear before the Lord Yahweh, the God of Israel."
2034024,2,34,24,"For I will drive out nations before you and enlarge your borders; neither shall any man desire your land when you go up to appear before Yahweh, your God, three times in the year."
2034025,2,34,25,"""You shall not offer the blood of my sacrifice with leavened bread; neither shall the sacrifice of the feast of the Passover be left to the morning."
2034026,2,34,26,"You shall bring the first of the first fruits of your ground to the house of Yahweh your God. You shall not boil a young goat in its mother's milk."""
2034027,2,34,27,"Yahweh said to Moses, ""Write you these words: for in accordance with these words I have made a covenant with you and with Israel."""
2034028,2,34,28,"He was there with Yahweh forty days and forty nights; he neither ate bread, nor drank water. He wrote on the tablets the words of the covenant, the ten commandments."
2034029,2,34,29,"It happened, when Moses came down from Mount Sinai with the two tablets of the testimony in Moses' hand, when he came down from the mountain, that Moses didn't know that the skin of his face shone by reason of his speaking with him."
2034030,2,34,30,"When Aaron and all the children of Israel saw Moses, behold, the skin of his face shone; and they were afraid to come near him."
2034031,2,34,31,"Moses called to them, and Aaron and all the rulers of the congregation returned to him; and Moses spoke to them."
2034032,2,34,32,"Afterward all the children of Israel came near, and he gave them all of the commandments that Yahweh had spoken with him on Mount Sinai."
2034033,2,34,33,"When Moses was done speaking with them, he put a veil on his face."
2034034,2,34,34,"But when Moses went in before Yahweh to speak with him, he took the veil off, until he came out; and he came out, and spoke to the children of Israel that which he was commanded."
2034035,2,34,35,"The children of Israel saw Moses' face, that the skin of Moses' face shone: and Moses put the veil on his face again, until he went in to speak with him."
2035001,2,35,1,"Moses assembled all the congregation of the children of Israel, and said to them, ""These are the words which Yahweh has commanded, that you should do them."
2035002,2,35,2,"'Six days shall work be done, but on the seventh day there shall be a holy day for you, a Sabbath of solemn rest to Yahweh: whoever does any work in it shall be put to death."
2035003,2,35,3,"You shall kindle no fire throughout your habitations on the Sabbath day.'"""
2035004,2,35,4,"Moses spoke to all the congregation of the children of Israel, saying, ""This is the thing which Yahweh commanded, saying,"
2035005,2,35,5,"'Take from among you an offering to Yahweh. Whoever is of a willing heart, let him bring it, Yahweh's offering: gold, silver, brass,"
2035006,2,35,6,"blue, purple, scarlet, fine linen, goats' hair,"
2035007,2,35,7,"rams' skins dyed red, sea cow hides, acacia wood,"
2035008,2,35,8,"oil for the light, spices for the anointing oil and for the sweet incense,"
2035009,2,35,9,"onyx stones, and stones to be set for the ephod and for the breastplate."
