id,b,c,v,t
45008006,45,8,6,"For the mind of the flesh is death, but the mind of the Spirit is life and peace;"
45008007,45,8,7,"because the mind of the flesh is hostile towards God; for it is not subject to God's law, neither indeed can it be."
45008008,45,8,8,Those who are in the flesh can't please God.
45008009,45,8,9,"But you are not in the flesh but in the Spirit, if it is so that the Spirit of God dwells in you. But if any man doesn't have the Spirit of Christ, he is not his."
45008010,45,8,10,"If Christ is in you, the body is dead because of sin, but the spirit is alive because of righteousness."
45008011,45,8,11,"But if the Spirit of him who raised up Jesus from the dead dwells in you, he who raised up Christ Jesus from the dead will also give life to your mortal bodies through his Spirit who dwells in you."
45008012,45,8,12,"So then, brothers, we are debtors, not to the flesh, to live after the flesh."
45008013,45,8,13,"For if you live after the flesh, you must die; but if by the Spirit you put to death the deeds of the body, you will live."
45008014,45,8,14,"For as many as are led by the Spirit of God, these are children of God."
45008015,45,8,15,"For you didn't receive the spirit of bondage again to fear, but you received the Spirit of adoption, by whom we cry, ""Abba{Abba is a Chaldee word for father or daddy, often used affectionately and respectfully in prayer to our Father in heaven.}! Father!"""
45008016,45,8,16,The Spirit himself testifies with our spirit that we are children of God;
45008017,45,8,17,"and if children, then heirs; heirs of God, and joint-heirs with Christ; if indeed we suffer with him, that we may also be glorified with him."
45008018,45,8,18,For I consider that the sufferings of this present time are not worthy to be compared with the glory which will be revealed toward us.
45008019,45,8,19,For the creation waits with eager expectation for the children of God to be revealed.
45008020,45,8,20,"For the creation was subjected to vanity, not of its own will, but because of him who subjected it, in hope"
45008021,45,8,21,that the creation itself also will be delivered from the bondage of decay into the liberty of the glory of the children of God.
45008022,45,8,22,For we know that the whole creation groans and travails in pain together until now.
45008023,45,8,23,"Not only so, but ourselves also, who have the first fruits of the Spirit, even we ourselves groan within ourselves, waiting for adoption, the redemption of our body."
45008024,45,8,24,"For we were saved in hope, but hope that is seen is not hope. For who hopes for that which he sees?"
45008025,45,8,25,"But if we hope for that which we don't see, we wait for it with patience."
45008026,45,8,26,"In the same way, the Spirit also helps our weaknesses, for we don't know how to pray as we ought. But the Spirit himself makes intercession for us with groanings which can't be uttered."
45008027,45,8,27,"He who searches the hearts knows what is on the Spirit's mind, because he makes intercession for the saints according to God."
45008028,45,8,28,"We know that all things work together for good for those who love God, to those who are called according to his purpose."
45008029,45,8,29,"For whom he foreknew, he also predestined to be conformed to the image of his Son, that he might be the firstborn among many brothers.{The word for ""brothers"" here and where context allows may also be correctly translated ""brothers and sisters"" or ""siblings.""}"
45008030,45,8,30,"Whom he predestined, those he also called. Whom he called, those he also justified. Whom he justified, those he also glorified."
45008031,45,8,31,"What then shall we say about these things? If God is for us, who can be against us?"
45008032,45,8,32,"He who didn't spare his own Son, but delivered him up for us all, how would he not also with him freely give us all things?"
45008033,45,8,33,Who could bring a charge against God's chosen ones? It is God who justifies.
45008034,45,8,34,"Who is he who condemns? It is Christ who died, yes rather, who was raised from the dead, who is at the right hand of God, who also makes intercession for us."
45008035,45,8,35,"Who shall separate us from the love of Christ? Could oppression, or anguish, or persecution, or famine, or nakedness, or peril, or sword?"
45008036,45,8,36,"Even as it is written, ""For your sake we are killed all day long. We were accounted as sheep for the slaughter."""
45008037,45,8,37,"No, in all these things, we are more than conquerors through him who loved us."
45008038,45,8,38,"For I am persuaded, that neither death, nor life, nor angels, nor principalities, nor things present, nor things to come, nor powers,"
45008039,45,8,39,"nor height, nor depth, nor any other created thing, will be able to separate us from the love of God, which is in Christ Jesus our Lord."
45009001,45,9,1,"I tell the truth in Christ. I am not lying, my conscience testifying with me in the Holy Spirit,"
45009002,45,9,2,that I have great sorrow and unceasing pain in my heart.
45009003,45,9,3,"For I could wish that I myself were accursed from Christ for my brothers' sake, my relatives according to the flesh,"
45009004,45,9,4,"who are Israelites; whose is the adoption, the glory, the covenants, the giving of the law, the service, and the promises;"
45009005,45,9,5,"of whom are the fathers, and from whom is Christ as concerning the flesh, who is over all, God, blessed forever. Amen."
45009006,45,9,6,"But it is not as though the word of God has come to nothing. For they are not all Israel, that are of Israel."
45009007,45,9,7,"Neither, because they are Abraham's seed, are they all children. But, ""In Isaac will your seed be called."""
45009008,45,9,8,"That is, it is not the children of the flesh who are children of God, but the children of the promise are counted as a seed."
45009009,45,9,9,"For this is a word of promise, ""At the appointed time I will come, and Sarah will have a son."""
45009010,45,9,10,"Not only so, but Rebecca also conceived by one, by our father Isaac."
45009011,45,9,11,"For being not yet born, neither having done anything good or bad, that the purpose of God according to election might stand, not of works, but of him who calls,"
45009012,45,9,12,"it was said to her, ""The elder will serve the younger."""
45009013,45,9,13,"Even as it is written, ""Jacob I loved, but Esau I hated."""
45009014,45,9,14,What shall we say then? Is there unrighteousness with God? May it never be!
45009015,45,9,15,"For he said to Moses, ""I will have mercy on whom I have mercy, and I will have compassion on whom I have compassion."""
45009016,45,9,16,"So then it is not of him who wills, nor of him who runs, but of God who has mercy."
45009017,45,9,17,"For the Scripture says to Pharaoh, ""For this very purpose I caused you to be raised up, that I might show in you my power, and that my name might be published abroad in all the earth."""
45009018,45,9,18,"So then, he has mercy on whom he desires, and he hardens whom he desires."
45009019,45,9,19,"You will say then to me, ""Why does he still find fault? For who withstands his will?"""
45009020,45,9,20,"But indeed, O man, who are you to reply against God? Will the thing formed ask him who formed it, ""Why did you make me like this?"""
45009021,45,9,21,"Or hasn't the potter a right over the clay, from the same lump to make one part a vessel for honor, and another for dishonor?"
45009022,45,9,22,"What if God, willing to show his wrath, and to make his power known, endured with much patience vessels of wrath made for destruction,"
45009023,45,9,23,"and that he might make known the riches of his glory on vessels of mercy, which he prepared beforehand for glory,"
45009024,45,9,24,"us, whom he also called, not from the Jews only, but also from the Gentiles?"
45009025,45,9,25,"As he says also in Hosea, ""I will call them 'my people,' which were not my people; And her 'beloved,' who was not beloved."""
45009026,45,9,26,"""It will be that in the place where it was said to them, 'You are not my people,' There they will be called 'children of the living God.'"""
45009027,45,9,27,"Isaiah cries concerning Israel, ""If the number of the children of Israel are as the sand of the sea, It is the remnant who will be saved;"
45009028,45,9,28,"For He will finish the work and cut it short in righteousness, Because the LORD will make a short work upon the earth."""
45009029,45,9,29,"As Isaiah has said before, ""Unless the Lord of Hosts{Greek: Sabaoth} had left us a seed, We would have become like Sodom, And would have been made like Gomorrah."""
45009030,45,9,30,"What shall we say then? That the Gentiles, who didn't follow after righteousness, attained to righteousness, even the righteousness which is of faith;"
45009031,45,9,31,"but Israel, following after a law of righteousness, didn't arrive at the law of righteousness."
45009032,45,9,32,"Why? Because they didn't seek it by faith, but as it were by works of the law. They stumbled over the stumbling stone;"
45009033,45,9,33,"even as it is written, ""Behold, I lay in Zion a stumbling stone and a rock of offense; And no one who believes in him will be disappointed."""
45010001,45,10,1,"Brothers, my heart's desire and my prayer to God is for Israel, that they may be saved."
45010002,45,10,2,"For I testify about them that they have a zeal for God, but not according to knowledge."
45010003,45,10,3,"For being ignorant of God's righteousness, and seeking to establish their own righteousness, they didn't subject themselves to the righteousness of God."
45010004,45,10,4,"For Christ is the fulfillment{or, completion, or end} of the law for righteousness to everyone who believes."
45010005,45,10,5,"For Moses writes about the righteousness of the law, ""The one who does them will live by them."""
45010006,45,10,6,"But the righteousness which is of faith says this, ""Don't say in your heart, 'Who will ascend into heaven?' (that is, to bring Christ down);"
45010007,45,10,7,"or, 'Who will descend into the abyss?' (that is, to bring Christ up from the dead.)"""
45010008,45,10,8,"But what does it say? ""The word is near you, in your mouth, and in your heart;"" that is, the word of faith, which we preach:"
45010009,45,10,9,"that if you will confess with your mouth the Lord Jesus, and believe in your heart that God raised him from the dead, you will be saved."
45010010,45,10,10,"For with the heart, one believes unto righteousness; and with the mouth confession is made unto salvation."
45010011,45,10,11,"For the Scripture says, ""Whoever believes in him will not be disappointed."""
45010012,45,10,12,"For there is no distinction between Jew and Greek; for the same Lord is Lord of all, and is rich to all who call on him."
45010013,45,10,13,"For, ""Whoever will call on the name of the Lord will be saved."""
45010014,45,10,14,How then will they call on him in whom they have not believed? How will they believe in him whom they have not heard? How will they hear without a preacher?
45010015,45,10,15,"And how will they preach unless they are sent? As it is written: ""How beautiful are the feet of those who preach the Gospel of peace, Who bring glad tidings of good things!"""
45010016,45,10,16,"But they didn't all listen to the glad news. For Isaiah says, ""Lord, who has believed our report?"""
45010017,45,10,17,"So faith comes by hearing, and hearing by the word of God."
45010018,45,10,18,"But I say, didn't they hear? Yes, most assuredly, ""Their sound went out into all the earth, Their words to the ends of the world."""
45010019,45,10,19,"But I ask, didn't Israel know? First Moses says, ""I will provoke you to jealousy with that which is no nation, With a nation void of understanding I will make you angry."""
45010020,45,10,20,"Isaiah is very bold, and says, ""I was found by those who didn't seek me. I was revealed to those who didn't ask for me."""
45010021,45,10,21,"But as to Israel he says, ""All day long I stretched out my hands to a disobedient and contrary people."""
45011001,45,11,1,"I ask then, Did God reject his people? May it never be! For I also am an Israelite, a descendant of Abraham, of the tribe of Benjamin."
45011002,45,11,2,"God didn't reject his people, which he foreknew. Or don't you know what the Scripture says about Elijah? How he pleads with God against Israel:"
45011003,45,11,3,"""Lord, they have killed your prophets, they have broken down your altars; and I am left alone, and they seek my life."""
45011004,45,11,4,"But how does God answer him? ""I have reserved for myself seven thousand men, who have not bowed the knee to Baal."""
45011005,45,11,5,Even so then at this present time also there is a remnant according to the election of grace.
45011006,45,11,6,"And if by grace, then it is no longer of works; otherwise grace is no longer grace. But if it is of works, it is no longer grace; otherwise work is no longer work."
45011007,45,11,7,"What then? That which Israel seeks for, that he didn't obtain, but the chosen ones obtained it, and the rest were hardened."
45011008,45,11,8,"According as it is written, ""God gave them a spirit of stupor, eyes that they should not see, and ears that they should not hear, to this very day."""
45011009,45,11,9,"David says, ""Let their table be made a snare, and a trap, A stumbling block, and a retribution to them."
45011010,45,11,10,"Let their eyes be darkened, that they may not see. Bow down their back always."""
45011011,45,11,11,"I ask then, did they stumble that they might fall? May it never be! But by their fall salvation has come to the Gentiles, to provoke them to jealousy."
45011012,45,11,12,"Now if their fall is the riches of the world, and their loss the riches of the Gentiles; how much more their fullness?"
45011013,45,11,13,"For I speak to you who are Gentiles. Since then as I am an apostle to Gentiles, I glorify my ministry;"
45011014,45,11,14,"if by any means I may provoke to jealousy those who are my flesh, and may save some of them."
45011015,45,11,15,"For if the rejection of them is the reconciling of the world, what would their acceptance be, but life from the dead?"
45011016,45,11,16,"If the first fruit is holy, so is the lump. If the root is holy, so are the branches."
45011017,45,11,17,"But if some of the branches were broken off, and you, being a wild olive, were grafted in among them, and became partaker with them of the root and of the richness of the olive tree;"
45011018,45,11,18,"don't boast over the branches. But if you boast, it is not you who support the root, but the root supports you."
45011019,45,11,19,"You will say then, ""Branches were broken off, that I might be grafted in."""
45011020,45,11,20,"True; by their unbelief they were broken off, and you stand by your faith. Don't be conceited, but fear;"
45011021,45,11,21,"for if God didn't spare the natural branches, neither will he spare you."
45011022,45,11,22,"See then the goodness and severity of God. Toward those who fell, severity; but toward you, goodness, if you continue in his goodness; otherwise you also will be cut off."
45011023,45,11,23,"They also, if they don't continue in their unbelief, will be grafted in, for God is able to graft them in again."
45011024,45,11,24,"For if you were cut out of that which is by nature a wild olive tree, and were grafted contrary to nature into a good olive tree, how much more will these, which are the natural branches, be grafted into their own olive tree?"
45011025,45,11,25,"For I don't desire, brothers,{The word for ""brothers"" here and where context allows may also be correctly translated ""brothers and sisters"" or ""siblings.""} to have you ignorant of this mystery, so that you won't be wise in your own conceits, that a partial hardening has happened to Israel, until the fullness of the Gentiles has come in,"
45011026,45,11,26,"and so all Israel will be saved. Even as it is written, ""There will come out of Zion the Deliverer, And he will turn away ungodliness from Jacob."
45011027,45,11,27,"This is my covenant to them, When I will take away their sins."""
45011028,45,11,28,"Concerning the Gospel, they are enemies for your sake. But concerning the election, they are beloved for the fathers' sake."
45011029,45,11,29,For the gifts and the calling of God are irrevocable.
45011030,45,11,30,"For as you in time past were disobedient to God, but now have obtained mercy by their disobedience,"
45011031,45,11,31,"even so these also have now been disobedient, that by the mercy shown to you they may also obtain mercy."
45011032,45,11,32,"For God has shut up all to disobedience, that he might have mercy on all."
45011033,45,11,33,"Oh the depth of the riches both of the wisdom and the knowledge of God! How unsearchable are his judgments, and his ways past tracing out!"
45011034,45,11,34,"""For who has known the mind of the Lord? Or who has been his counselor?"""
45011035,45,11,35,"""Or who has first given to him, And it will be repaid to him again?"""
45011036,45,11,36,"For of him, and through him, and to him, are all things. To him be the glory for ever! Amen."
45012001,45,12,1,"Therefore I urge you, brothers, by the mercies of God, to present your bodies a living sacrifice, holy, acceptable to God, which is your spiritual service."
45012002,45,12,2,"Don't be conformed to this world, but be transformed by the renewing of your mind, so that you may prove what is the good, well-pleasing, and perfect will of God."
45012003,45,12,3,"For I say, through the grace that was given me, to every man who is among you, not to think of himself more highly than he ought to think; but to think reasonably, as God has apportioned to each person a measure of faith."
45012004,45,12,4,"For even as we have many members in one body, and all the members don't have the same function,"
45012005,45,12,5,"so we, who are many, are one body in Christ, and individually members one of another."
45012006,45,12,6,"Having gifts differing according to the grace that was given to us, if prophecy, let us prophesy according to the proportion of our faith;"
45012007,45,12,7,"or service, let us give ourselves to service; or he who teaches, to his teaching;"
45012008,45,12,8,"or he who exhorts, to his exhorting: he who gives, let him do it with liberality; he who rules, with diligence; he who shows mercy, with cheerfulness."
45012009,45,12,9,Let love be without hypocrisy. Abhor that which is evil. Cling to that which is good.
45012010,45,12,10,In love of the brothers be tenderly affectionate one to another; in honor preferring one another;
45012011,45,12,11,not lagging in diligence; fervent in spirit; serving the Lord;
45012012,45,12,12,rejoicing in hope; enduring in troubles; continuing steadfastly in prayer;
45012013,45,12,13,contributing to the needs of the saints; given to hospitality.
45012014,45,12,14,"Bless those who persecute you; bless, and don't curse."
45012015,45,12,15,Rejoice with those who rejoice. Weep with those who weep.
45012016,45,12,16,"Be of the same mind one toward another. Don't set your mind on high things, but associate with the humble. Don't be wise in your own conceits."
45012017,45,12,17,Repay no one evil for evil. Respect what is honorable in the sight of all men.
45012018,45,12,18,"If it is possible, as much as it is up to you, be at peace with all men."
45012019,45,12,19,"Don't seek revenge yourselves, beloved, but give place to God's wrath. For it is written, ""Vengeance belongs to me; I will repay, says the Lord."""
45012020,45,12,20,"Therefore ""If your enemy is hungry, feed him. If he is thirsty, give him a drink. For in doing so, you will heap coals of fire on his head."""
45012021,45,12,21,"Don't be overcome by evil, but overcome evil with good."
45013001,45,13,1,"Let every soul be in subjection to the higher authorities, for there is no authority except from God, and those who exist are ordained by God."
45013002,45,13,2,"Therefore he who resists the authority, withstands the ordinance of God; and those who withstand will receive to themselves judgment."
45013003,45,13,3,"For rulers are not a terror to the good work, but to the evil. Do you desire to have no fear of the authority? Do that which is good, and you will have praise from the same,"
45013004,45,13,4,"for he is a servant of God to you for good. But if you do that which is evil, be afraid, for he doesn't bear the sword in vain; for he is a minister of God, an avenger for wrath to him who does evil."
45013005,45,13,5,"Therefore you need to be in subjection, not only because of the wrath, but also for conscience' sake."
45013006,45,13,6,"For this reason you also pay taxes, for they are ministers of God's service, attending continually on this very thing."
45013007,45,13,7,Give therefore to everyone what you owe: taxes to whom taxes are due; customs to whom customs; respect to whom respect; honor to whom honor.
45013008,45,13,8,"Owe no one anything, except to love one another; for he who loves his neighbor has fulfilled the law."
45013009,45,13,9,"For the commandments, ""You shall not commit adultery,"" ""You shall not murder,"" ""You shall not steal,"" ""You shall not give false testimony,"" ""You shall not covet,""{TR adds ""You shall not give false testimony,""} and whatever other commandments there are, are all summed up in this saying, namely, ""You shall love your neighbor as yourself."""
45013010,45,13,10,Love doesn't harm a neighbor. Love therefore is the fulfillment of the law.
45013011,45,13,11,"Do this, knowing the time, that it is already time for you to awaken out of sleep, for salvation is now nearer to us than when we first believed."
45013012,45,13,12,"The night is far gone, and the day is near. Let's therefore throw off the works of darkness, and let's put on the armor of light."
45013013,45,13,13,"Let us walk properly, as in the day; not in reveling and drunkenness, not in sexual promiscuity and lustful acts, and not in strife and jealousy."
45013014,45,13,14,"But put on the Lord Jesus Christ, and make no provision for the flesh, for its lusts."
45014001,45,14,1,"Now receive one who is weak in faith, but not for disputes over opinions."
45014002,45,14,2,"One man has faith to eat all things, but he who is weak eats only vegetables."
45014003,45,14,3,"Don't let him who eats despise him who doesn't eat. Don't let him who doesn't eat judge him who eats, for God has received him."
45014004,45,14,4,"Who are you who judge another's servant? To his own lord he stands or falls. Yes, he will be made to stand, for God has power to make him stand."
45014005,45,14,5,One man esteems one day as more important. Another esteems every day alike. Let each man be fully assured in his own mind.
45014006,45,14,6,"He who observes the day, observes it to the Lord; and he who does not observe the day, to the Lord he does not observe it. He who eats, eats to the Lord, for he gives God thanks. He who doesn't eat, to the Lord he doesn't eat, and gives God thanks."
45014007,45,14,7,"For none of us lives to himself, and none dies to himself."
45014008,45,14,8,"For if we live, we live to the Lord. Or if we die, we die to the Lord. If therefore we live or die, we are the Lord's."
45014009,45,14,9,"For to this end Christ died, rose, and lived again, that he might be Lord of both the dead and the living."
45014010,45,14,10,"But you, why do you judge your brother? Or you again, why do you despise your brother? For we will all stand before the judgment seat of Christ."
45014011,45,14,11,"For it is written, ""'As I live,' says the Lord, 'to me every knee will bow. Every tongue will confess to God.'"""
45014012,45,14,12,So then each one of us will give account of himself to God.
45014013,45,14,13,"Therefore let's not judge one another any more, but judge this rather, that no man put a stumbling block in his brother's way, or an occasion for falling."
45014014,45,14,14,"I know, and am persuaded in the Lord Jesus, that nothing is unclean of itself; except that to him who considers anything to be unclean, to him it is unclean."
45014015,45,14,15,"Yet if because of food your brother is grieved, you walk no longer in love. Don't destroy with your food him for whom Christ died."
45014016,45,14,16,"Then don't let your good be slandered,"
45014017,45,14,17,"for the Kingdom of God is not eating and drinking, but righteousness, peace, and joy in the Holy Spirit."
45014018,45,14,18,For he who serves Christ in these things is acceptable to God and approved by men.
45014019,45,14,19,"So then, let us follow after things which make for peace, and things by which we may build one another up."
45014020,45,14,20,"Don't overthrow God's work for food's sake. All things indeed are clean, however it is evil for that man who creates a stumbling block by eating."
45014021,45,14,21,"It is good to not eat meat, drink wine, nor do anything by which your brother stumbles, is offended, or is made weak."
45014022,45,14,22,Do you have faith? Have it to yourself before God. Happy is he who doesn't judge himself in that which he approves.
45014023,45,14,23,"But he who doubts is condemned if he eats, because it isn't of faith; and whatever is not of faith is sin. (14:24) Now to him who is able to establish you according to my Gospel and the preaching of Jesus Christ, according to the revelation of the mystery which has been kept secret through long ages, (14:25) but now is revealed, and by the Scriptures of the prophets, according to the commandment of the eternal God, is made known for obedience of faith to all the nations; (14:26) to the only wise God, through Jesus Christ, to whom be the glory forever! Amen.{TR places verses 24-26 after Romans 16:24 as verses 25-27.}"
45015001,45,15,1,"Now we who are strong ought to bear the weaknesses of the weak, and not to please ourselves."
45015002,45,15,2,"Let each one of us please his neighbor for that which is good, to be building him up."
