id,b,c,v,t
45015003,45,15,3,"For even Christ didn't please himself. But, as it is written, ""The reproaches of those who reproached you fell on me."""
45015004,45,15,4,"For whatever things were written before were written for our learning, that through patience and through encouragement of the Scriptures we might have hope."
45015005,45,15,5,"Now the God of patience and of encouragement grant you to be of the same mind one with another according to Christ Jesus,"
45015006,45,15,6,that with one accord you may with one mouth glorify the God and Father of our Lord Jesus Christ.
45015007,45,15,7,"Therefore receive one another, even as Christ also received you,{TR reads ""us"" instead of ""you""} to the glory of God."
45015008,45,15,8,"Now I say that Christ has been made a minister of the circumcision for the truth of God, that he might confirm the promises given to the fathers,"
45015009,45,15,9,"and that the Gentiles might glorify God for his mercy. As it is written, ""Therefore will I give praise to you among the Gentiles, And sing to your name."""
45015010,45,15,10,"Again he says, ""Rejoice, you Gentiles, with his people."""
45015011,45,15,11,"Again, ""Praise the Lord, all you Gentiles! Let all the peoples praise him."""
45015012,45,15,12,"Again, Isaiah says, ""There will be the root of Jesse, He who arises to rule over the Gentiles; On him will the Gentiles hope."""
45015013,45,15,13,"Now may the God of hope fill you with all joy and peace in believing, that you may abound in hope, in the power of the Holy Spirit."
45015014,45,15,14,"I myself am also persuaded about you, my brothers{The word for ""brothers"" here and where context allows may also be correctly translated ""brothers and sisters"" or ""siblings.""}, that you yourselves are full of goodness, filled with all knowledge, able also to admonish others."
45015015,45,15,15,"But I write the more boldly to you in part, as reminding you, because of the grace that was given to me by God,"
45015016,45,15,16,"that I should be a servant of Christ Jesus to the Gentiles, ministering as a priest the Gospel of God, that the offering up of the Gentiles might be made acceptable, sanctified by the Holy Spirit."
45015017,45,15,17,I have therefore my boasting in Christ Jesus in things pertaining to God.
45015018,45,15,18,"For I will not dare to speak of any things except those which Christ worked through me, for the obedience of the Gentiles, by word and deed,"
45015019,45,15,19,"in the power of signs and wonders, in the power of God's Spirit; so that from Jerusalem, and around as far as to Illyricum, I have fully preached the Gospel of Christ;"
45015020,45,15,20,"yes, making it my aim to preach the Gospel, not where Christ was already named, that I might not build on another's foundation."
45015021,45,15,21,"But, as it is written, ""They will see, to whom no news of him came. They who haven't heard will understand."""
45015022,45,15,22,"Therefore also I was hindered these many times from coming to you,"
45015023,45,15,23,"but now, no longer having any place in these regions, and having these many years a longing to come to you,"
45015024,45,15,24,"whenever I journey to Spain, I will come to you. For I hope to see you on my journey, and to be helped on my way there by you, if first I may enjoy your company for a while."
45015025,45,15,25,"But now, I say, I am going to Jerusalem, serving the saints."
45015026,45,15,26,For it has been the good pleasure of Macedonia and Achaia to make a certain contribution for the poor among the saints who are at Jerusalem.
45015027,45,15,27,"Yes, it has been their good pleasure, and they are their debtors. For if the Gentiles have been made partakers of their spiritual things, they owe it to them also to serve them in fleshly things."
45015028,45,15,28,"When therefore I have accomplished this, and have sealed to them this fruit, I will go on by way of you to Spain."
45015029,45,15,29,"I know that, when I come to you, I will come in the fullness of the blessing of the Gospel of Christ."
45015030,45,15,30,"Now I beg you, brothers, by our Lord Jesus Christ, and by the love of the Spirit, that you strive together with me in your prayers to God for me,"
45015031,45,15,31,"that I may be delivered from those who are disobedient in Judea, and that my service which I have for Jerusalem may be acceptable to the saints;"
45015032,45,15,32,"that I may come to you in joy through the will of God, and together with you, find rest."
45015033,45,15,33,Now the God of peace be with you all. Amen.
45016001,45,16,1,"I commend to you Phoebe, our sister, who is a servant{literally, deacon} of the assembly that is at Cenchreae,"
45016002,45,16,2,"that you receive her in the Lord, in a way worthy of the saints, and that you assist her in whatever matter she may need from you, for she herself also has been a helper of many, and of my own self."
45016003,45,16,3,"Greet Prisca and Aquila, my fellow workers in Christ Jesus,"
45016004,45,16,4,"who for my life, laid down their own necks; to whom not only I give thanks, but also all the assemblies of the Gentiles."
45016005,45,16,5,"Greet the assembly that is in their house. Greet Epaenetus, my beloved, who is the first fruits of Achaia to Christ."
45016006,45,16,6,"Greet Mary, who labored much for us."
45016007,45,16,7,"Greet Andronicus and Junias, my relatives and my fellow prisoners, who are notable among the apostles, who also were in Christ before me."
45016008,45,16,8,"Greet Amplias, my beloved in the Lord."
45016009,45,16,9,"Greet Urbanus, our fellow worker in Christ, and Stachys, my beloved."
45016010,45,16,10,"Greet Apelles, the approved in Christ. Greet those who are of the household of Aristobulus."
45016011,45,16,11,"Greet Herodion, my kinsman. Greet them of the household of Narcissus, who are in the Lord."
45016012,45,16,12,"Greet Tryphaena and Tryphosa, who labor in the Lord. Greet Persis, the beloved, who labored much in the Lord."
45016013,45,16,13,"Greet Rufus, the chosen in the Lord, and his mother and mine."
45016014,45,16,14,"Greet Asyncritus, Phlegon, Hermes, Patrobas, Hermas, and the brothers{The word for ""brothers"" here and where context allows may also be correctly translated ""brothers and sisters"" or ""siblings.""} who are with them."
45016015,45,16,15,"Greet Philologus and Julia, Nereus and his sister, and Olympas, and all the saints who are with them."
45016016,45,16,16,Greet one another with a holy kiss. The assemblies of Christ greet you.
45016017,45,16,17,"Now I beg you, brothers, look out for those who are causing the divisions and occasions of stumbling, contrary to the doctrine which you learned, and turn away from them."
45016018,45,16,18,"For those who are such don't serve our Lord, Jesus Christ, but their own belly; and by their smooth and flattering speech, they deceive the hearts of the innocent."
45016019,45,16,19,"For your obedience has become known to all. I rejoice therefore over you. But I desire to have you wise in that which is good, but innocent in that which is evil."
45016020,45,16,20,And the God of peace will quickly crush Satan under your feet. The grace of our Lord Jesus Christ be with you.
45016021,45,16,21,"Timothy, my fellow worker, greets you, as do Lucius, Jason, and Sosipater, my relatives."
45016022,45,16,22,"I, Tertius, who write the letter, greet you in the Lord."
45016023,45,16,23,"Gaius, my host and host of the whole assembly, greets you. Erastus, the treasurer of the city, greets you, as does Quartus, the brother."
45016024,45,16,24,The grace of our Lord Jesus Christ be with you all! Amen.
45016025,45,16,25,{See Romans 14:23}
45016026,45,16,26,{See Romans 14:23}
45016027,45,16,27,"{See Romans 14:23} {TR places Romans 14:24-26 at the end of Romans instead of at the end of chapter 14, and numbers these verses 16:25-27.}"